{
  "$schema": "../../schemas/topic_pack_profile.schema.json",
  "schema_version": "topic-profile-v1",
  "profile_id": "implementation_evaluation_v1",
  "question_type": "IMPLEMENTATION_EVALUATION",
  "source_files": [
    "README.md",
    "fact_anchor.json",
    "logic_check.json",
    "model_answer.json",
    "topic_importance.json"
  ],
  "fixed_values": {
    "deterministic_checks_enabled": false,
    "finding_fields": [
      "candidate_id",
      "rule_id",
      "severity",
      "message",
      "correct_rule"
    ]
  },
  "content_contract": {
    "required_spec_fields": [
      "schema_version",
      "profile_id",
      "topic_id",
      "title_ko",
      "question_type",
      "difficulty",
      "selection_importance",
      "scope_summary",
      "ownership_statements",
      "counts",
      "anchors",
      "fatal_wrong_claims",
      "major_checks",
      "question_patterns",
      "recommended_outline",
      "routing_aliases",
      "high_band_unlock_conditions",
      "revision_notes",
      "handoffs"
    ],
    "count_fields": [
      "anchors",
      "fatal_wrong_claims",
      "major_checks",
      "question_patterns",
      "recommended_outline",
      "routing_aliases",
      "high_band_unlock_conditions",
      "revision_notes"
    ]
  },
  "canonical_files": {
    "fact_anchor.json": {
      "shape_hash": "b5727996e5c09e598caae6710c525c78fc94a0c86ae03d9ecb736534aa64669c",
      "required_top_level_keys": [
        "anchors",
        "core_facts",
        "fatal_wrong_claims",
        "question_type_hint",
        "revision_notes",
        "safe_expressions",
        "schema_version",
        "title_ko",
        "topic_id",
        "topic_label"
      ],
      "shape_schema": {
        "type": "object",
        "properties": {
          "anchors": {
            "type": "array",
            "items": {
              "type": "object",
              "properties": {
                "accepted_explanations": {
                  "type": "array",
                  "items": {
                    "type": "string"
                  }
                },
                "anchor_id": {
                  "type": "string"
                },
                "claim": {
                  "type": "string"
                },
                "core_terms": {
                  "type": "array",
                  "items": {
                    "type": "string"
                  }
                },
                "description": {
                  "type": "string"
                },
                "grading_notes": {
                  "type": "string"
                },
                "id": {
                  "type": "string"
                },
                "importance": {
                  "type": "string",
                  "enum": [
                    "core",
                    "must",
                    "important"
                  ]
                },
                "keywords": {
                  "type": "array",
                  "items": {
                    "type": "string"
                  }
                },
                "rejected_explanations": {
                  "type": "array",
                  "items": {
                    "type": "string"
                  }
                },
                "source_basis": {
                  "type": "string"
                },
                "statement": {
                  "type": "string"
                }
              },
              "required": [
                "accepted_explanations",
                "anchor_id",
                "claim",
                "core_terms",
                "description",
                "grading_notes",
                "id",
                "importance",
                "keywords",
                "rejected_explanations",
                "source_basis",
                "statement"
              ],
              "additionalProperties": false
            }
          },
          "core_facts": {
            "type": "array",
            "items": {
              "type": "string"
            }
          },
          "fatal_wrong_claims": {
            "type": "array",
            "items": {
              "type": "object",
              "properties": {
                "affected_layers": {
                  "type": "array",
                  "items": {
                    "type": "string"
                  }
                },
                "claim": {
                  "type": "string"
                },
                "correct_rule": {
                  "type": "string"
                },
                "correction": {
                  "type": "string"
                },
                "description": {
                  "type": "string"
                },
                "grading_notes": {
                  "type": "string"
                },
                "id": {
                  "type": "string"
                },
                "message": {
                  "type": "string"
                },
                "severity": {
                  "type": "string"
                },
                "wrong_claim": {
                  "type": "string"
                },
                "error_class": {
                  "type": "string",
                  "minLength": 1
                },
                "claim_signature": {
                  "type": "string",
                  "minLength": 1
                },
                "anchor_refs": {
                  "type": "array",
                  "minItems": 1,
                  "items": {
                    "type": "string",
                    "minLength": 1
                  },
                  "uniqueItems": true
                },
                "demand_refs": {
                  "type": "array",
                  "minItems": 1,
                  "items": {
                    "type": "string",
                    "minLength": 1
                  },
                  "uniqueItems": true
                }
              },
              "required": [
                "affected_layers",
                "claim",
                "correct_rule",
                "correction",
                "description",
                "grading_notes",
                "id",
                "message",
                "severity",
                "wrong_claim"
              ],
              "additionalProperties": false
            }
          },
          "question_type_hint": {
            "type": "string"
          },
          "revision_notes": {
            "type": "array",
            "items": {
              "type": "string"
            }
          },
          "safe_expressions": {
            "type": "array",
            "items": {
              "type": "string"
            }
          },
          "schema_version": {
            "type": "string"
          },
          "title_ko": {
            "type": "string"
          },
          "topic_id": {
            "type": "string"
          },
          "topic_label": {
            "type": "string"
          }
        },
        "required": [
          "anchors",
          "core_facts",
          "fatal_wrong_claims",
          "question_type_hint",
          "revision_notes",
          "safe_expressions",
          "schema_version",
          "title_ko",
          "topic_id",
          "topic_label"
        ],
        "additionalProperties": false
      },
      "template": {
        "schema_version": "topic_pack.fact_anchor.v1",
        "topic_id": "",
        "title_ko": "",
        "question_type_hint": "",
        "anchors": [
          {
            "id": "",
            "anchor_id": "",
            "statement": "",
            "importance": "",
            "keywords": [
              ""
            ],
            "core_terms": [
              ""
            ],
            "accepted_explanations": [
              ""
            ],
            "rejected_explanations": [
              ""
            ],
            "grading_notes": "",
            "source_basis": "",
            "claim": "",
            "description": ""
          }
        ],
        "core_facts": [
          ""
        ],
        "fatal_wrong_claims": [
          {
            "id": "",
            "claim": "",
            "wrong_claim": "",
            "correction": "",
            "correct_rule": "",
            "severity": "",
            "affected_layers": [
              ""
            ],
            "message": "",
            "description": "",
            "grading_notes": ""
          }
        ],
        "safe_expressions": [
          ""
        ],
        "revision_notes": [
          ""
        ],
        "topic_label": ""
      }
    },
    "logic_check.json": {
      "shape_hash": "516f358c910fc42470ad7f135bc09fffcdca87f97b364c19075ac95cec2af216",
      "required_top_level_keys": [
        "deterministic_checks",
        "llm_profile",
        "revision_notes",
        "schema_version",
        "title",
        "topic_id",
        "topic_label"
      ],
      "shape_schema": {
        "type": "object",
        "properties": {
          "deterministic_checks": {
            "type": "object",
            "properties": {
              "de_claim_trust": {
                "type": "object",
                "properties": {},
                "required": [],
                "additionalProperties": false
              },
              "difficulty_profile": {
                "type": "string"
              },
              "enabled": {
                "type": "boolean"
              },
              "fatal_checks": {
                "type": "array",
                "items": {}
              },
              "major_checks": {
                "type": "array",
                "items": {}
              },
              "next_practice_points": {
                "type": "array",
                "items": {}
              },
              "question_type": {
                "type": "string"
              },
              "question_type_checks": {